{
  "$schema": "http://json-schema.org/draft-07/schema#",
  "$id": "https://deme.dev/schemas/npc.schema.json",
  "title": "NPC",
  "description": "A non-player character entity. One entity per file, conventionally content/npcs/<id>.json.",
  "type": "object",
  "required": ["id", "type", "name"],
  "properties": {
    "id": { "$ref": "common.schema.json#/definitions/entityId" },
    "type": { "const": "npc" },
    "name": { "type": "string", "minLength": 1 },
    "description": { "type": "string" },
    "sprite": {
      "type": "string",
      "description": "Path to the NPC's sprite asset, relative to the content package root."
    },
    "dialogueTreeId": {
      "$ref": "common.schema.json#/definitions/entityId",
      "description": "References a content/dialogues/*.json entity of type \"dialogueTree\" started when this NPC is talked to."
    },
    "interactions": {
      "type": "array",
      "description": "Script(s) run when the player interacts with this NPC (e.g. on-look). Talking normally starts dialogueTreeId rather than running a script directly.",
      "items": { "$ref": "common.schema.json#/definitions/scriptRef" },
      "default": []
    }
  },
  "additionalProperties": false
}
