{
  "id": "jeeves",
  "type": "npc",
  "name": "Jeeves",
  "description": "The house butler, endlessly patient — even about being locked in with you.",
  "sprite": "assets/npcs/jeeves.png",
  "dialogueTreeId": "jeeves-intro",
  "interactions": [
    {
      "hook": "on-look",
      "source": "describe(\"Jeeves stands at attention, awaiting instruction.\")"
    }
  ]
}
